{
  "$schema": "https://json-schema.org/draft/2020-12/schema",
  "$id": "https://mulesoft.com/schemas/semantic-contract-v1.schema.json",
  "title": "Semantic Contract v1",
  "description": "A versioned, machine-evaluated description of what an MCP tool result means. Consumed by the MCP Semantic Contract Omni Gateway policy.",
  "type": "object",
  "additionalProperties": false,
  "required": ["semanticContractVersion", "contractId", "version", "toolMapping", "rules"],
  "properties": {
    "semanticContractVersion": {
      "const": "1.0",
      "description": "Dialect version of this document."
    },
    "contractId": {
      "type": "string",
      "pattern": "^[a-z0-9][a-z0-9-]{0,63}$",
      "description": "Stable identifier. Appears in metrics and merge ordering, never in injected text."
    },
    "version": {
      "type": "string",
      "pattern": "^[0-9]+\\.[0-9]+\\.[0-9]+$",
      "description": "Semantic version of the contract content."
    },
    "description": {
      "type": "string",
      "maxLength": 512,
      "description": "Human-facing note for reviewers. Never injected."
    },
    "owner": {
      "type": "string",
      "maxLength": 128,
      "description": "Team accountable for the correctness of these rules."
    },
    "toolMapping": {
      "type": "array",
      "minItems": 1,
      "uniqueItems": true,
      "items": { "type": "string", "minLength": 1 },
      "description": "Tool names this contract governs. Must be non-empty; a contract bound to no tool is rejected at load time."
    },
    "rules": {
      "type": "array",
      "minItems": 1,
      "items": { "$ref": "#/$defs/rule" }
    }
  },
  "$defs": {
    "rule": {
      "type": "object",
      "additionalProperties": false,
      "required": ["id", "severity", "guidance"],
      "properties": {
        "id": {
          "type": "string",
          "pattern": "^[a-z0-9][a-z0-9-]{0,63}$",
          "description": "Unique within the contract. Prefixes the guidance line in the injected block and is the merge/dedupe key."
        },
        "severity": {
          "enum": ["info", "warn", "critical"],
          "description": "Budget drop order is info, then warn. A critical rule is never dropped."
        },
        "when": {
          "type": "string",
          "minLength": 1,
          "maxLength": 512,
          "description": "jsonpath-subset expression evaluated against the bound payload. Mutually exclusive with always. A malformed expression disables this rule only."
        },
        "always": {
          "const": true,
          "description": "Fire unconditionally on every matched call. Mutually exclusive with when."
        },
        "guidance": {
          "type": "string",
          "minLength": 1,
          "maxLength": 1024,
          "description": "The text appended to result.content[]. Never truncated: a rule is injected whole or not at all."
        },
        "reference": {
          "type": "string",
          "maxLength": 256,
          "description": "Link or ticket justifying the rule. Never injected."
        }
      },
      "oneOf": [
        { "required": ["when"], "not": { "required": ["always"] } },
        { "required": ["always"], "not": { "required": ["when"] } }
      ]
    }
  }
}
