{
  "semanticContractVersion": "1.0",
  "contractId": "erp-delivery",
  "version": "1.0.0",
  "description": "Operational overlays for SAP SD outbound delivery documents. Every rule here is keyed off a value in the payload but carries a fact that is not in the payload and could not be written into the tool's outputSchema, because it is true only right now and it is held in a system the ERP delivery API does not read: quality holds, carrier incidents, licence status, engineering changes, legal matters, migration cutovers. Field meaning that is stable for every delivery — what podReceived implies under DAP, how estimatedArrival is derived — belongs in erp-delivery.outputschema.json and is deliberately not repeated here. The owner of each rule is the team that holds the fact, never the team that owns the API.",
  "owner": "erp-platform",
  "toolMapping": ["get_delivery_document"],
  "rules": [
    {
      "id": "batch-under-recall",
      "severity": "critical",
      "when": "payload.items[0].batchNumber == \"B-7741-2026\" or payload.items[1].batchNumber == \"B-7741-2026\"",
      "guidance": "A line on this delivery was picked from batch B-7741-2026, which Quality Assurance placed under recall QN-2026-0412 on 2026-08-15. Stock from that batch is not fit for use. Do not confirm this delivery to the customer, do not quote an arrival date for it, and route it to Quality Assurance before any customer contact.",
      "reference": "QN-2026-0412"
    },
    {
      "id": "carrier-service-suspended",
      "severity": "critical",
      "when": "payload.shipping.carrier == \"EXP-DE\" and payload.shipping.serviceLevel == \"EXPRESS\"",
      "guidance": "Express service through carrier EXP-DE has been suspended since 2026-08-16 following the fire at their Cologne hub. estimatedArrival on this document was calculated from the contracted transit time before the suspension and no longer holds. Do not quote it. Logistics is re-routing affected consignments and issues replacement dates directly.",
      "reference": "LOG-INC-2026-0231"
    },
    {
      "id": "export-licence-missing",
      "severity": "critical",
      "when": "exists(payload.exportControl.eccn) and payload.exportControl.licenseNumber == null",
      "guidance": "The goods on this delivery are export controlled but no licence is recorded against it. Under trade compliance standard TC-114 the goods may not be released, and the consignee, the routing and the arrival date must not be disclosed to anyone outside the licensed party list. Do not answer customer questions about this shipment; escalate to Trade Compliance.",
      "reference": "TC-114"
    },
    {
      "id": "customer-communication-hold",
      "severity": "critical",
      "when": "payload.header.shipToParty == \"C-10029\"",
      "guidance": "Ship-to party C-10029 is in active commercial dispute under legal matter LEG-2026-0088. All outbound communication about their deliveries must be routed through Legal. Do not draft, suggest or send any customer-facing message about this delivery.",
      "reference": "LEG-2026-0088"
    },
    {
      "id": "material-superseded",
      "severity": "warn",
      "when": "payload.items[0].material == \"MAT-88120\" or payload.items[1].material == \"MAT-88120\"",
      "guidance": "Material MAT-88120 was superseded by MAT-88121 on 2026-08-03 under engineering change ECN-4471. Stock on this delivery is pre-change and does not meet the current drawing revision, so it may not be interchangeable with what the customer expects. Confirm with Engineering before telling them this fulfils their requirement.",
      "reference": "ECN-4471"
    },
    {
      "id": "legacy-plant-pricing",
      "severity": "warn",
      "when": "payload.header.plant == \"1042\" and payload.header.createdOn < \"2026-08-01\"",
      "guidance": "Plant 1042 cut over to the new pricing engine on 2026-08-01. Documents created there before that date carry conditions that were not migrated, so netValue on these lines is not authoritative. Re-price in the live system before quoting any amount from this delivery.",
      "reference": "FI-MIG-1042"
    }
  ]
}
