{
  "semanticContractVersion": "1.0",
  "contractId": "erp-sales-order",
  "version": "3.1.0",
  "description": "Interpretation rules for SAP SD sales order documents surfaced through the ERP MCP asset.",
  "owner": "erp-platform",
  "toolMapping": ["get_sales_order"],
  "rules": [
    {
      "id": "uom-external",
      "severity": "info",
      "when": "payload.items[0].uom != payload.items[0].salesUom",
      "guidance": "Item quantities are in the base unit of measure (uom), not the unit the customer transacts in (salesUom). Convert with conversionFactor before quoting any quantity back to the customer.",
      "reference": "ERP-SD-1142"
    },
    {
      "id": "shipped-means-goods-issued",
      "severity": "critical",
      "when": "payload.items[0].deliveredQuantity > 0 and payload.items[0].goodsIssuedQuantity == 0",
      "guidance": "deliveredQuantity counts stock staged for delivery, not stock that has left the warehouse. Nothing has shipped until goodsIssuedQuantity is greater than zero. Do not tell the customer these units are on their way.",
      "reference": "ERP-SD-0873"
    },
    {
      "id": "delivery-block-active",
      "severity": "warn",
      "when": "payload.header.deliveryBlock != null",
      "guidance": "A delivery block is set on the order header. No delivery will be created while the block is in place, regardless of stock availability or confirmed dates.",
      "reference": "ERP-SD-0910"
    },
    {
      "id": "confirmed-date-stale",
      "severity": "warn",
      "when": "payload.header.deliveryBlock != null and exists(payload.schedule.confirmedDeliveryDate)",
      "guidance": "confirmedDeliveryDate is frozen at order creation and is not rescheduled when a delivery block is applied. With a block active this date is stale and must not be quoted as the expected delivery date.",
      "reference": "ERP-SD-0911"
    },
    {
      "id": "credit-blocked-over-limit",
      "severity": "critical",
      "when": "payload.credit.creditStatus == \"B\" and payload.credit.exposure > payload.credit.creditLimit",
      "guidance": "The order is credit-blocked because the customer's exposure exceeds their credit limit. This is the root cause of any delay on this order and it will not release until credit is cleared by finance.",
      "reference": "ERP-FI-0455"
    },
    {
      "id": "holds-role-filtered",
      "severity": "warn",
      "when": "sizeOf(payload.holds) == 0 and payload.header.deliveryBlock != null",
      "guidance": "An empty holds array means holds were filtered out by the caller's role, not that none exist. A delivery block is present, so at least one hold record exists that this caller cannot see. Do not state that the order is free of holds.",
      "reference": "ERP-SD-1207"
    },
    {
      "id": "replica-stale",
      "severity": "critical",
      "when": "payload.meta.replicationLagSeconds > 300",
      "guidance": "This document was read from a replica lagging more than five minutes behind the system of record. Credit, pricing and quantity fields may be out of date and must not be quoted as authoritative to a customer.",
      "reference": "ERP-OPS-0021"
    }
  ]
}
